{
  "schema_version": 1,
  "record_type": "INPUT_MANIFEST",
  "record_id": "fdcc1c5b32bd008d976c20671af67384bc0d595cc4b0f8f84691ee9b0d412ff3",
  "recorded_at": "2026-09-23T09:16:00Z",
  "experiment_id": "reviewer-next-open-v1",
  "mode": "SYNTHETIC",
  "availability_class": "SYNTHETIC",
  "brief_hash": "bf1a2c3d4e5f6a7b8c9d0e1f2a3b4c5d6e7f8a9b0c1d2e3f4a5b6c7d8e9f0a1b",
  "data_hash": "da2b3c4d5e6f7a8b9c0d1e2f3a4b5c6d7e8f9a0b1c2d3e4f5a6b7c8d9e0f1a2b",
  "feature_version": "rolling-atr14-v1",
  "strategy": "key_level_sweep_v1",
  "strategy_version": "0.1.0",
  "strategy_parameters": {"min_confidence": 0.55},
  "config_hash": "cf3c4d5e6f7a8b9c0d1e2f3a4b5c6d7e8f9a0b1c2d3e4f5a6b7c8d9e0f1a2b3c",
  "broker_profile_hash": "bp4d5e6f7a8b9c0d1e2f3a4b5c6d7e8f9a0b1c2d3e4f5a6b7c8d9e0f1a2b3c4d",
  "symbol": "XAUUSD",
  "timeframe": "M15",
  "instrument": {
    "venue": "SYNTHETIC",
    "kind": "CFD",
    "quote_currency": "USD",
    "account_currency": "USD",
    "contract_size": 100.0,
    "tick_size": 0.01,
    "lot_step": 0.01
  },
  "issued_at": "2026-09-23T08:00:00Z",
  "received_at": "2026-09-23T08:01:00Z",
  "verified_available_at": null,
  "availability_evidence": null,
  "data_start": "2026-09-23T08:00:00Z",
  "data_end": "2026-09-23T10:00:00Z",
  "policy": {
    "version": "next-open-v1",
    "price_basis": "MID_WITH_MODELLED_SPREAD",
    "entry": "NEXT_BAR_OPEN",
    "same_bar": "AMBIGUOUS_STOP_FIRST",
    "max_holding_bars": 8,
    "entry_session_timezone": "Europe/London",
    "entry_cutoff_utc": "2026-09-23T12:00:00Z",
    "risk_model": "FIXED_RISK_PCT",
    "risk_pct": 0.005,
    "max_open_positions": 1,
    "calendar_state": "VERIFIED_CLEAR",
    "cost_model_version": "fixture-zero-cost-v1"
  }
}
